"","id","lyric"
"18","3aBL75wBGHJnskegE9jyhb","I've been on top for a while (Top for a while);NASA shippin' to the moon;Fast car make vroom, vroom, vroom;Take her to The Boom Boom Room;I'm a visionary, I got these niggas scary, hmm;Bought a big Patek with a brand new wrist setting, hmm;Inside the new Maybach coupe peanut butter, jelly, mm;I'ma slide in the Rolls, slide in the Lamb, slide in the Benz;Been workin' on my confidence;And respect, I get a lot of it;I don't ever mean to contradict;If it's up then it's up with us;Tell 'em pour another cup with us (Pour that, pour that);Even my brother sippin' mud with me;My bitch is a ten, my jet in the wind, I fought just to win;My dawg just caught another body, now he poppin' Xannies again;Caught his ass slippin' at the cul-de-sac;Slidin' on the opps, playin' toe tag (Tag);Just in Miami, I was chillin where the Zoes at;In the Rolls Royce, I don't need the LoJack;Keep the forty-five I had to hold it (Hold it);Gotta ride with it 'cause I'm chosen;I just pulled up on Lamby-Lamb;Playin' dice with Mustard, bet it on the four-to-ten;I remember wonderin' when I'm gon' eat;Pull up the Bentley with no key;I've been on top for a while (Top for a while);NASA shippin' to the moon;Fast car make vroom, vroom, vroom;Take her to The Boom Boom Room;I'm a visionary, I got these niggas scary, hmm;Bought a big Patek with a brand new wrist setting, hmm;Inside the new Maybach coupe peanut butter, jelly, mm;I'ma slide in the Rolls, slide in the Lamb, slide in the Benz;Been workin' on my confidence;And respect, I get a lot of it;I don't ever mean to contradict;If it's up then it's up with us;The mud, sippin' on mud;Niggas talkin' shit but they never ever knew us;I've been on top for a while (Top for a while);NASA shippin' to the moon;Fast car make vroom, vroom, vroom;Take her to The Boom Boom Room;I'm a visionary, I got these niggas scary, hmm;Bought a big Patek with a brand new wrist setting, hmm;Inside the new Maybach coupe peanut butter, jelly, mm;I'ma slide in the Rolls, slide in the Lamb, slide in the Benz;Been workin' on my confidence;And respect, I get a lot of it;I don't ever mean to contradict;If it's up then it's up with us"
"19","3t6x1j9DqfV83a5EXIwBc3","DJ on the beat so it's a banger;All this clout shit, you chasin' that, Balenciaga, space cadet;I don't even fuck with niggas, I'd just rather chase a check;Man, this shit so crazy, seen my idol with a fake Patek;I just sent my bitch to Bora Bora, cost me 80 racks;I'm the one, bitch asked me for a flight when she ain't ate it yet;I'ma hit that road and try to jam until I make it back;Can't no real nigga lie on they word and try to take it back;I might mix my Percocet with red, I can't find the Act;Off a lotta pills, kissin' bitches, ew;Designer junkie, yeah, only top Chanel;Don't get caught with the scale, bro 'nem died in the field;We had to split our meals, went half for hotels;Gotta watch your mans, that's the beauty of the streets;Look at me and my bitch, that shit Beauty and the Beast;Never call my phone about the opps 'cause ain't no peace;Man this shit for real, found out my homie, he police;All this clout shit, you chasin' that, Balenciaga, space cadet;I don't even fuck with niggas, I'd just rather chase a check;Man, this shit so crazy, seen my idol with a fake Patek;I just sent my bitch to Bora Bora, cost me 80 racks;I'm the one, bitch asked me for a flight when she ain't ate it yet;I'ma hit that road and try to jam until I make it back;Can't no real nigga lie on they word and try to take it back;I might mix my Percocet with red, I can't find the Act;Funeral, suit and tie, I'll shoot for the guys;Takin' shrooms on me now, car go vroom on them now;I got groupies on me now, I got Gucci on me now;I put blood in my Shahada, I got kufis with me now;Feel like I'm dyin', I'm too high, Pluto died in the Chi;Got me ridin' around, hunnid rounds on him now;Hunnid rounds on him now;Pluto died in the Chi, Pluto...;All this clout shit, you chasin' that, Balenciaga, space cadet;I don't even fuck with niggas, I'd just rather chase a check;Man, this shit so crazy, seen my idol with a fake Patek;I just sent my bitch to Bora Bora, cost me 80 racks;I'm the one, bitch asked me for a flight when she ain't ate it yet;I'ma hit that road and try to jam until I make it back;Can't no real nigga lie on they word and try to take it back;I might mix my Percocet with red, I can't find the Act"
"20","735RSTb2xbtWbDtKD9XDYi","Internet Money, bitch;We love you, Tecca;Why you jackin' static, jackin' static 'til we roll up;I got all these bitches lovin' me like I am Sosa;Stop talkin' with your chest, lil' bitty bitch, you better bold up;Told her, ""Hit my jack,"" and when she hit me, told her, ""Hold up"";I just want somebody, 'body;To treat me like somebody, 'body;And not like anybody, 'body;All you gotta do is love me for me, girl;I just want somebody, 'body (Yeah, yeah);To treat me like somebody, 'body (Yeah, yeah, yeah);And not like anybody, 'body;All you gotta do is love me for me, girl;I just want somebody, body;To treat me like somebody, body;You wanna talk? You better call me, call me;Don't gotta wait, don't gotta stall me, stall me;You know I'm on my phone, I pick it up when it ring;You know I hit you back, 'cause you is my everything;You know you'd be my queen if you let me be your king;You know you wanna jam, so I got you with anything (Yeah);Why you jackin' static, jackin' static 'til we roll up;I got all these bitches lovin' me like I am Sosa;Stop talkin' with your chest, lil' bitty bitch, you better bold up;Told her, ""Hit my jack,"" and when she hit me, told her, ""Hold up"";I just want somebody, 'body;To treat me like somebody, 'body;And not like anybody, 'body;All you gotta do is love me for me, girl;I just want somebody, 'body (Yeah, yeah);To treat me like somebody, 'body (Yeah, yeah, yeah);And not like anybody, 'body;All you gotta do is love me for me, girl;I'm sick of actin' like everything's okay when it's not good;Nowadays everybody wanna be top one;I don't feel nobody, I be talkin' to my shotgun;In the two-seater, my shawty playin' shotgun;But I need somebody, 'body, yeah;Niggas movin' wocky, wocky, yeah;My car key got a button to start it;I don't think A Boogie really fuckin' with Artist;King of the jungle in the 'Rari, yeah;Don't be lyin', I know you fuckin' somebody else;But, hey, big thottie, you like to party, yeah;But don't you call me my nickname, don't call me Artie, yeah;Why you jackin' static, jackin' static 'til we roll up;I got all these bitches lovin' me like I am Sosa;Stop talkin' with your chest, lil' bitty bitch, you better bold up;Told her, ""Hit my jack,"" and when she hit me, told her, ""Hold up"";I just want somebody, 'body;To treat me like somebody, 'body;And not like anybody, 'body;All you gotta do is love me for me, girl;I just want somebody, 'body (Yeah, yeah);To treat me like somebody, 'body (Yeah, yeah, yeah);And not like anybody, 'body;All you gotta do is love me for me, girl;I just want somebody;To treat me like somebody;And not like anybody"
"21","0afRXmECMzKR1tsiGSUW6g","Zaytoven;Uh, I make, real music for the pain and struggle;'Cause that's where I come from;Look;I was in the trenches with my gun;Now I'm gettin' cake, I made them savings for my son;Thank you for this paper, God, I can pay my bond;Judge got me on stuck, he think I'm tryna make a run, uh;Puttin' digits up, feel like I'm tryna make a fund;I will not go back to where I came but it was fun;All the weight I took on by myself felt like a ton;Made it out the ghetto with no help, feel like I won, ayy;Yeah, jewelry hittin' in the sun;Water on my neck and wrists, I hid it in the pond;I'ma be the last nigga when it's said and done;Move like a pimp, was sippin' drank but I'm not Bun;Came up with crack but made it big, feel like I'm Pun;Niggas on my back with hands out ain't help me none (Nigga);My brother was a legend, he in Heaven now;Should've been right there, feel like I let him down;My brother was a legend, he in Heaven;All my faith in God and my weapons;My brother was a legend, he in Heaven now;Should've been right there, feel like I let him down;Rappers goin' hard but they life a facade;Gamblin' with my life the devil playin' cards;In the street all night, that's the shit that left me scarred;Situations like my first one, that's what gave me heart;I ain't never carry heat, but that's what made me start;Hoodie on, it was dark, all I saw was sparks;I ain't ever been afraid of the dark;Brave nights I lay, put the car in park;Paranoia every day, yeah that's how it started;Why I don't feel safe? I got a bodyguard;Hard times tested ain't a nigga around;Everybody ain't ready to lay a nigga down;My brother was a legend, he in Heaven;All my faith in God and my weapons;My brother was a legend, he in Heaven now;Should've been right there, feel like I let him down"
"22","1VbUG8x9XUCLipOVohGgU0","Yeah, you know I don't never know what to say right here;Daytrip took it to ten;Bitch, I be goin' HARD;I getcho nigga HARD;This blunt is hittin' HARD;And what I'm whippin', HARD;Bitch, I be goin' HARD;I got yo nigga HARD;This blunt I'm hittin' HARD;And what I'm whippin', HARD;Smoke bamboo, big lit, thick white bitch Iggy;You know my weed sticky, what's the secret Vicky?;We be turnt like Timmy then we roll out like Jimmy;My show sold out in your city, you can't keep up wit me;Sit on his face ‘til his nose gone;To put me down you need both arms;These bitches mad cause I go hard;Ready, set, I got on Goyard;Chains on my belt, I'm a rockstar;Don't need ID, I use facecard;These niggas dig me like a graveyard;I work hard so I get to play hard;Bitch, I be goin' HARD;I getcho nigga HARD;This blunt is hittin' HARD;And what I'm whippin', HARD;Bitch, I be goin' HARD;I got yo nigga HARD;This blunt I'm hittin' HARD;And what I'm whippin', HARD;What I got on, it ain't come from the store;They see me soon as I walk through the door;I'm up on the roof, I was just on the floor;How the fuck did I get rich when I was just poor?;All of these blessings, I'm thankin' the lord;I'm never stoppin' I gotta keep goin';I don't use the brakes when I'm drivin' a foreign;I only go faster, I never go slower;Ballin' so hard like, “what's the score?”;If she want beef, I need a fork;I know it hurt them to the core;Your nigga a lame, a bitch, a dork;Bitch I come from nothin', every day I'm stuntin';I know you ain't got this, bought it out the country;Money don't mean nothin', get it like it's double;If we get into it, you know you in trouble;Bitch, I be goin' HARD;I getcho nigga HARD;This blunt is hittin' HARD;And what I'm whippin', HARD;Bitch, I be goin' HARD;I got yo nigga HARD;This blunt I'm hittin' HARD;And what I'm whippin', HARD"
"23","0UPBidRYcgJ2mjZlk08V8x","(Fuck niggas, I don't trust niggas;If  you bust triggers and you tell, you a fuck nigga);If  you tell, you a fuck nigga;(How you tell on the gang? If you mention my name;Boy, I promise I'ma kill you, better duck, nigga;What's  up with you? I grew up with you;Used  to fuck with you, now I'm wishing that a bus hit you;I used to fuck with you, now I'm wishing that a bus hit you);(Fuck  niggas, I don't trust niggas;If you bust triggers and you tell, you a fuck nigga);Fuck nigga;Nah, Lil Tjay (Fuck nigga), yeah, yeah;(Now  I'm wishing that a bus hit you);Yeah, yeah, yeah (Skrrt, skrrt, yeah);Grrr, pow, I'ma skip town, see my wrist drown;Everybody wanna fuck with me for benefits now;Man, I wish my nigga Smelly could've seen me lit now;Sit down, maybe roll up, blow a spliff down;Time go by, niggas change so much;Why the fuck these niggas looking at my chain so much?;They just mad 'cause I departed from the game so much;One false move and the gang gon' bust;Cartier glasses, 20/20, got a clear view;You a man, I don't fear you;Act up, we gon' mask up, boy, I dare you;Brody catch a body, I'ma leave you in the rearview;Could have did it to me, lil' nigga, you were scared to;You a bluff and you not who you appear to;You'd be starstruck if you see a nigga near you;And your bitch wanna fuck, I don't care to;Careful, if I say links, plan's canceled;I can have your shorty in my bed doing dance moves;Fuck that, let's get right back to the real shit;In the field shit, niggas really used to drill shit;Mama stressed out, whole lot she gotta deal with;Swear every real nigga gon' feel this;Smokin' on drugs 'cause there's too much to deal with;SB strapped up in the field with it;Fuck niggas, I don't trust niggas;If you bust triggers and you tell, you a fuck nigga;How you tell on the gang? If you mention my name;Boy, I promise I'ma kill you, better duck, nigga;What's up with you? I grew up with you;Used to fuck with you, now I'm wishing that a bus hit you;I used to fuck with you, now I'm wishing that a bus hit you;Fuck niggas, I don't trust niggas;If you bust triggers and you tell, you a fuck nigga;How you tell on the gang? If you mention my name;Boy, I promise I'ma kill you, better duck, nigga;What's up with you? I grew up with you;Used to fuck with you, now I'm wishing that a bus hit you;I used to fuck with you, now I'm wishing that a bus hit you;My mama know about the pain, thought I'd never change;But looking back, for the fame, I felt the same;I was stuck up in the streets, but I had a brain;I ain't have no money, we was looking for a nigga chain;And shit, all I ever wanted was to have a name;Had a lot of shit to lose, not enough to gain;And that fuck nigga changed, went against the grain;Found out my homie went fed, almost went insane;Strictly business, you ain't with it, you get parked, nigga;I don't know you, you wasn't with me from the start, nigga;I remember catching stains in the park, nigga;Me and Bubba tryna catch an opp after dark, nigga;My mama told me, ""Wisen up, be a smart nigga"";So all my niggas on go like a kart, nigga;Smelly drive mean a bullet to your heart, nigga;I don't really wanna speak facts, see the chart, nigga;Grrr, pow, I'ma skip town, see my wrist drown;Everybody wanna fuck with me for benefits now;Man, I wish my nigga Smelly could've seen me lit now;Sit down, maybe roll up, blow a spliff down;Time go by, niggas change so much;Why the fuck these niggas looking at my chain so much?;They just mad 'cause I departed from the game so much;One false move and the gang gon' bust;Fuck niggas, I don't trust niggas;If you bust triggers and you tell, you a fuck nigga;How you tell on the gang? If you mention my name;Boy, I promise I'ma kill you, better duck, nigga;What's up with you? I grew up with you;Used to fuck with you, now I'm wishing that a bus hit you;I used to fuck with you, now I'm wishing that a bus hit you;Fuck niggas, I don't trust niggas;If you bust triggers and you tell, you a fuck nigga;How you tell on the gang? If you mention my name;Boy, I promise I'ma kill you, better duck, nigga;What's up with you? I grew up with you;Used to fuck with you, now I'm wishing that a bus hit you;I used to fuck with you, and now I'm wishing that a bus hit you;Lil Tjay;Yeah, yeah, yeah;Oh"
"24","3uIVdQmgp3IPLC8vXgZmgv","Ay yo Bans, what you cookin'?;(Oh yeah,);(Yeah);I think I done seen it all;And I'm only nineteen;Do it for prosper, he ain't get to live his dream;I swear this shit ain't what it seem;Went and bought a crib for the team;I won't do the pills or the lean;But I'm a fiend for the weed, I like to get high;2 Jays to start the day, that's just to get by;Took a ten out the bank, that's just to get fly;Seeking revenge 'cause it ain't nice when the kid cry;(Everyday another kid die);What's understood for everybody to understand;But Imma leave it in God's hand;Cause all of this God's plan;And I heard what God said;In the jungle, like Tarzan;And my mom with her apartment;These streets made a man of me;A grown man, beefin' with grown men;This shit made me my own man;But I'm a strong man;They had to cut off my whole hand, I like to kill;I know they wouldn't do the same for me, let's keep it real;Who could I call them for them video shoots, I need a fix;Those n*ggas had it they ain't wanna give me shit;Them same n*ggas on they're dick;But they don't think we know all on their Instagram shit;But they don't let it show;What's understood for everybody to understand;But Imma leave it in God's hand;Cause all of it's God's plan;And I heard what God said;In the jungle, like Tarzan;And my mom with her apartment;Always kept it real, I never changed how I felt;All them n*ggas show their hand;That shit'll do ya by yourself;I smoke a dank all by myself;I sit and think about my health;Cause I ain't feeling like myself;Like do I really like myself?;Like I really don't feel like-;My lips too big that why they sag;I'm too insecure that's why I, um;But this just me, no it's not them;I know I'm me but I'm not him;I try to see but I won't see 'em;I kill 'em off before I fail;What's understood for everybody to understand;But Imma leave it in God's hand;Cause all of it's God's plan;And I heard what God said;In the jungle, like Tarzan;And my mom with her apartment;These streets made a man of me;A grown man, beefin' with grown men;This shit made me my own man;But I'm a strong man;The streets made a man of me, a grown man;Messing with grown men;That shit made me my own men;But I wasn't grown, man"
"25","6dIhYbdq4cf56bptIYyswE","Ladies and gentlemen;Juvie;Introducing Jazze Phazzle, woo;Blac Youngsta;DaBaby (J Phazzle);Suckin' like a pro (Whore);Bad bitch, pulled down, popped up;Fucked me like a pro (Whore);I'ma count up on your legs, propped up;Smoking out the bowl;I'm a young rich nigga, bossed up;Feed me like a goat;Bad bitch, bad bitch, bad bitch;Fucked me like a pro;Bad bitches put your back into it;Broke up with my bitch, you know we back into it;Fucked me like a pro;Fucking bitches out in Hollywood;Bring your problems, make sure that my problems good;Fucked me like a pro;I'ma run a train, make 'em line up, fuck 'em all together;She was here when I ain't really have shit, we gon' ball together (My bitch);My bitch she a really good bitch, do what I tell her (Thick);If you heard her when she called me ""Da-da,"" then you would think I had her (Pop off);I'm the type of nigga that'll pick my shit and leave;Type of nigga keep a bad bitch on my sleeve;Fuck me like a pro (Gang, gang);I'm the type of nigga that'll pull up with the weed;Type of nigga keep a bad bitch on her knees;Suckin' like a pro;You the type of nigga tryna keep up with the speed;I'm the type of nigga tell the ho I can't read;'Cause I'm counting slow (Whore);Fucked a tall, lanky bird bitch in the trees;When I told my home boys, they couldn't believe, that she;Suckin' like a pro (Whore);Bad bitch, pulled down, popped up;Fucked me like a pro (Whore);I'ma count up on your legs, propped up;Smoking out the bowl;I'm a young rich nigga, bossed up;Feed me like a goat;Bad bitch, bad bitch, bad bitch;Fucked me like a pro;Bad bitches put your back into it;Broke up with my bitch, you know we back into it;Fucked me like a pro;Fucking bitches out in Hollywood;Bring your problems, make sure that my problems good;Fucked me like a pro;Roc-A-Fella bitches treat me like I'm Jigga;I ain't her nigga, but she fuck me like I'm her nigga;She gon' fuck me like a ho (Give it to me);I feel like Superman when I hit her;She say I'm black just like I'm Youngsta, nigga play with us and we dumpin', we on ""Go"";Ain't no bitch finna be off limits for you, nigga;She know I can fuck whenever I want that's why I ask if she got a lil' busy;She bounce that ass like ""Wow"" (Let's go);Yeah, that's how it sound, we fuck on the ground, she throw it like ""Bow"" (Yeah, yeah);I'm feeling like Creed, I'm 'bout to get beat, throw in the towel (Okay);She fuck me so good, fell in love with it;She know I get nasty, I put my thumb in the butt;Got her falling in love with me (Bitch);I'm with your bitch, giving her dick, dawg, while you take her in public;The way that I pay attention when that ass clap;You could say that I study it;Suckin' like a pro (Whore);Bad bitch, pulled down, popped up;Fucked me like a pro (Whore);I'ma count up on your legs, propped up;Smoking out the bowl;I'm a young rich nigga, bossed up;Feed me like a goat;Bad bitch, bad bitch, bad bitch;Fucked me like a pro;Bad bitches put your back into it;Broke up with my bitch, you know we back into it;Fucked me like a pro;Fucking bitches out in Hollywood;Bring your problems, make sure that my problems good;Fucked me like a pro"
"26","7tVTYf17rcDEGrr6qHZNqc","And uh, mmm, mmm (Is this loud enough?);Just a lil' bit;Can you turn my headphones up? (Yup);D.A. got that dope;Uh;Dropped outta college, but bitch, I'm still ballin';I know that you jealous a little bit;She seen my picture and heard I'm a singer;If I pull it out, then she kissin' it;I'm taking chances and chasing advances;If life is a bet, then I'm riskin' it;Skrrt off the block in a Fisker whip;You know that I had to figure it out;What would you do for the clout? (Clout);Dropped outta college, but bitch, I'm still ballin';I know that you jealous a little bit;Cry to your mama;You don't want no drama;Even as a kid you was sensitive;Flex on the 'Gram, you ain't really rich;Everyone know that you rented it;Money, I'm countin' for twenty-four hours;It's harder to save when it's comin' in;Can't make a clone 'cause I'm one-of-one;Lil' boy, you ain't even one of them;I hit the Bowflex, got my muscle up;Two twins, tell 'em double dutch;Two twins, had to double cup;And they both dance, told 'em, ""Fuck it up"";Frostbite, Fortnite;Foreign cars on a foreign line;Foreign broads and they all fine;Yeah, yeah, yeah, they all mine;Switch it up, money dance;Workin' smart, makin' bands;Tryna see you drop and get naked, yeah;Ten, ten, twenties, baby, tryna see you shake it, yeah;Dropped outta college, but bitch, I'm still ballin';I know that you jealous a little bit;She seen my picture and heard I'm a singer;If I pull it out, then she kissin' it;I'm taking chances and chasing advances;If life is a bet, then I'm riskin' it;Skrrt off the block in a Fisker whip;You know that I had to figure it out;What would you do for the clout? (Clout);Dropped outta college, but bitch, I'm still ballin';I know that you jealous a little bit"
"27","5bVaWFbTBV7tSs6L0ZnILR","It's gon' get betta;Day to day they tell me keep my head up yeah;Got caught in a wave of rain but I ain't even wearing no sweater yeah;In the game but I paid, lord knows I know he fed up yeah;Have you checked the weather? yeah;Man it's gon' get better yeah, yeah;Used to write us love letters;It's gon' get better yeah, yeah;Now it's like I never met her;It's gon' get better yeah, yeah;Everyday we smokin' pressure;It's gon' get better yeah;Niggas they don't want no pressure;It's gon' get better yeah;You ain't ever ""tell me get up now"";I got some cheddar got no time to catch up yeah;Niggas wanna get wanna get a head of us hit 'em from the neck boy you bet not test us yeah;All my niggas really need me;'Member we was out here totin' now we gettin' tokens nigga like Luigi, these VV's;Ever since I got some money all she want designer;I just think it's really funny how my little honey think she's gettin' Prada, but nada;Duckin' groupies while I'm rockin' Gucci and Gabbana;She in love with the drama;Lil mama actin' like my mama, Madonna;Reminiscing on a minute when you had to hook me;Missin' we was always kissin';You was always trippin' only cuz you love me;Now it's fuck me;Running through these bitches;I don't get it why they trust me;Only cuz they wanna fuck me;All my denim fitted you can't cuff me, don't touch me;It's gon' get betta (It's gon' get better yeah);Day to day they tell me keep my head up yeah (Gotta keep my head up yeah);Got caught in a wave of rain but I ain't even wearing no sweater yeah (I ain't wearin' no sweater no);In the game but I paid, lord knows I know he fed up yeah (I know he fed up fed up);Have you checked the weather? yeah (Have you checked the weather weather?);Man it's gon' get better yeah, yeah (Yeah, yeah, yeah);Used to write us love letters;It's gon' get better yeah, yeah (No, no no);Now it's like I never met her;It's gon' get better yeah, yeah (yeah, yeah, yeah);Everyday we smokin' pressure;It's gon' get better yeah (No, no, no);Niggas they don't want no pressure;Bouta get this cheddar yeah;Me and gang stayed the same;Gotta stick together yeah;Bitches sayin' that I changed;Fuck 'em all whatever yeah;I just stay up in my lane had to get my bread up yeah;Swear to god I'll never let up;Bitches wanna fuck and never met up;When I fuck her I'mma fuck her better yeah;Put her leg up yeah;Kiss her neck up yeah;Choke her neck up yeah;Lick her chest up yeah;Fuck the bed up yeah;God damn yeah;She gon' bring her head up yeah;Clean the mess up yeah;When I sped up yeah;Got her wetter yeah;She can't get up yeah;Should've kept up yeah god damn yeah;It's gon' get betta (It's gon' get better yeah);Day to day they tell me keep my head up yeah (Gotta keep my head up yeah);Got caught in a wave of rain but I ain't even wearing no sweater yeah (I ain't wearin' no sweater no);In the game but I paid, lord knows I know he fed up yeah (I know he fed up fed up);Have you checked the weather? yeah (Have you checked the weather weather?);Man it's gon' get better yeah, yeah (Yeah, yeah, yeah);Used to write us love letters;It's gon' get better yeah, yeah (No, no no);Now it's like I never met her;It's gon' get better yeah, yeah (yeah, yeah, yeah);Everyday we smokin' pressure;It's gon' get better yeah (No, no, no);Niggas they don't want no pressure"
