"","id","lyric"
"64","1R11kvkIH0Y9CfGf7X4v58","I trapped on the night shift;I seen my uncle addicted to white shit;I pulled up with a nice bitch;My license suspended so that's who I slide with;I'm ready for anything;Outside with a Glock, in jail with an ice pick;Just put your money down;Nobody make a move until the dice hit (M-M-Murda, uh);I got my money up (Uh);Tellin' promoters I switched up my prices;I brought Dre Mack with me (Mack);He gon' run down, he don't care who your wife is (He don't care);I'm tryna live righteous (Righteous);Couldn't get bail, they said he was a flight risk (Pew);Why these niggas on my dick? (Why?);If I see it, I want it, I like it, I buy it;You need like fifty pills? I could get 'em;I got like nine bitches in the Sprinter;I just got some head, she just wanted dinner;Half my niggas dead, half up in the prison;40 on me, handle business;I ain't got no time to think about no witness;Leave 'em in the river, wakin' up with fishes;I get all my diamonds from the district;I got all my haters at attention;Try pull me over, not stoppin' at lights;If I hop out, I'm jumpin' over fences;Can't fuck with bitches, they just want attention;My diamonds yellow, I look like a Simpson;Her brain amazin' like she went to Princeton (Amazing);Her name was Monica, I felt like Clinton;I trapped on the night shift (Graveyard);I seen my uncle addicted to white shit (White shit);I pulled up with a nice bitch;My license suspended so that's who I slide with (Skrrt);I'm ready for anything (Anything);Outside with a Glock, in jail with an ice pick;Just put your money down;Nobody make a move until the dice hit (Uh);I got my money up (Uh);Tellin' promoters I switched up my prices;I brought Dre Mack with me (Mack);He gon' run down, he don't care who your wife is (He don't care);I'm tryna live righteous (Righteous);Couldn't get bail, they said he was a flight risk (Pew);Why these niggas on my dick? (Why?);If I see it, I want it, I like it, I buy it;We in New York (York);Couldn't get the blicky, so I got the knife in;Bad vibe with me, lightskin;And she textin', say I'm trifling;I've been sipping all this syrup;Then I looked up, damn, where the night went?;Maybach with the light tint;I gotta see if the cops coming;If the paper the subject, I ain't done;If the bitch is not fucking, she can't come;I've been popping these Addys, I can't sleep;I've been Cripping on beats like I'm Dave East;Put a new supercharger on a Hellcat;Had a hell of a week, where the bales at?;Tryna put that ho leg where her arm at;This shit deeper than rap, we be on that;I trapped on the night shift (Graveyard);I seen my uncle addicted to white shit (White shit);I pulled up with a nice bitch;My license suspended so that's who I slide with (Skrrt);I'm ready for anything (Anything);Outside with a Glock, in jail with an ice pick;Just put your money down;Nobody make a move until the dice hit;I got my money up;Tellin' promoters I switched up my prices;I brought Dre Mack with me;He gon' run down, he don't care who your wife is;I'm tryna live righteous;Couldn't get bail, they said he was a flight risk;Why these niggas on my dick?;If I see it, I want it, I like it, I buy it;Um, like, what is you doin'?;Is you rappin'? You trappin'? Like;Pick up your fucking phone;Stop playing with me, like I know you not that fucking busy, like;And it better not be no bitches in there;I'm not playing, yo;I'm in Los Angeles, cool, but I've always been scandalous;We might rob you and your manager;Photographer with you, we need a new camera;After we shoot, light a candle up;Don't hit her phone when I land in her city;That shit got her all in her feelings (My bad);I don't get searched;So I got hitters that pass me a strap 'til they get in the building;I come from public housing where they killing;Couldn't get a job is why he started dealing;Couldn't get no help is why he started stealing;He not hisself, that's why they never feel him;I ain't popped a Xan' in a minute;I ain't fucked a fan in a minute;Last time, was standing up in it;Disrespect my man, I'm offended;I trapped on the night shift (Graveyard);I seen my uncle addicted to white shit (White shit);I pulled up with a nice bitch;My license suspended so that's who I slide with (Skrrt);I'm ready for anything (Anything);Outside with a Glock, in jail with an ice pick;Just put your money down;Nobody make a move until the dice hit (Uh);I got my money up (Uh);Tellin' promoters I switched up my prices;I brought Dre Mack with me (Mack);He gon' run down, he don't care who your wife is (He don't care);I'm tryna live righteous (Righteous);Couldn't get bail, they said he was a flight risk (Pew);Why these niggas on my dick? (Why?);If I see it, I want it, I like it, I buy it"
"65","4B1HkmoPxGnIiovU1iy4IL","'Cause we got the bag on, tell 'em we getting money;Look, look;We getting money, please do not act like you know me 'cause we got the bag on;Tell 'em we getting money;Bitches gon' act like they love us, gon' treesh for the bag on;Tell 'em we getting money;Young niggas flexing we flipping a bag on;Tell 'em we getting money;You disrespecting we droppin' a bag on a nigga;We getting money, please do not act like you know me 'cause we got the bag on;Tell 'em we getting money;Bitches gon' act like they love us, gon' treesh for the bag on;Tell 'em we getting money;Young niggas flexing we flipping a bag on;Tell 'em we getting money;You disrespecting we droppin' a bag on a nigga;Look at me now;I was the kid on the block, I was lightin' shit up like some watch, it get hot like a fever;Dropped out of school, caught some charges, I never thought that I would beat 'em;Free Billy, free Caesar, nigga;I see you faking that smile underneath and you mad as fuck, huh It's funny they love when you down, when you up they be mad as fuck, huh;Man, I know some young niggas catching them bodies but them niggas virgins;And I know some niggas who talk like they 'bout it but drills be unheard of;And I see 'em niggas who following copying tryna be the gang;But we could never be the same 'cause my niggas putting in pain;We switchin' up game;We getting money, please do not act like you know me 'cause we got the bag on;Tell 'em we getting money;Bitches gon' act like they love us, gon' treesh for the bag on;Tell 'em we getting money;Young niggas flexing we flipping a bag on;Tell 'em we getting money;You disrespecting we droppin' a bag on a nigga;We getting money, please do not act like you know me 'cause we got the bag on;Tell 'em we getting money;Bitches gon' act like they love us, gon' treesh for the bag on;Tell 'em we getting money;Young niggas flexing we flipping a bag on;Tell 'em we getting money;You disrespecting we droppin' a bag on a nigga;Gang with us;You do not bang, I can't trust you, we carry no lames with us, huh;You switched on gang for a bitch;Ain't no sorry, she led you too stray from us, huh;They talk about drilling, they talk about drilling, they talk about drilling, look;They talk about drilling, they talk about drilling, talk about drilling Talk about drilling and fuck it, you thinking I'm soft, bitch you bugging, my anger be sudden;I'ma just brtt to bratt'ing and then unload my guns;Bro, you back with 'em, they get the panickin';Look at 'em feeling that pain from the bullets, them hallows is aching 'em;Legs get to shaking and mans can't do shit for you, he could hit with you;R. I .P. Status, you know them niggas meant for you;'Cause we def' ain't missin' you;Told them I switch up the music but these niggas chatting, look;Last year, was into the drilling, but fuck it, 'cause these niggas rattin', look;I told them I switch up the music, but these niggas really be chattin';And last year, was into the drilling but fuck it 'cause these niggas rattin';We gettin' money, man, we gettin' money, man, we gettin' money;We gettin' money, man, we gettin' money, man, we gettin' money;We gettin' money, man, we gettin' money, man, we gettin' money;We gettin' money, man, we gettin' money;We gettin' money"
"66","09luPlDQhtKITKU1JfxZfw","'Round here ('Round here, ayy);'Round here ('Round here);'Round here (Here), ayy;We don't breaks 'round here;Won't fuck with no niggas that's fake 'round here, 'round here;Ain't nobody fake 'round here;Young nigga gotta do what it takes 'round here, 'round here;Niggas gettin' paid 'round here;I'll pull up in Lamb 'round here, 'round here, 'round here;Niggas hittin' licks 'round here;If she think that she gon' get hit 'round here, 'round here, 'round here;Ain't no games 'round here;Young nigga won't play 'round here, 'round here, 'round here;We was tryna stay low-key;Somehow e'rybody know me 'round here, 'round here;Y'all niggas talkin' them G's;My niggas been gettin' to the mills 'round here, 'round here;Y'all niggas ain't out here;Y'all niggas ain't out here;Yeah, I just feel like this is our year;She wanna come fuck me, oh, yeah;Yeah, I don't even gotta call her;Yeah, she pullin' up, she want a baller, ayy, ayy;I could switch the lanes on you, yeah, yeah;Had to switch the game on you, yeah, yeah;Quick to drop a bag on you;Want it then I cop it, pop the tag, all true, yeah;And we don't take breaks 'round here;Drop a new tape and she playin' me like it's new Drake 'round here, 'round here;Bake when we wake out here;Young niggas really wanna get the cake 'round here, 'round here;You already know 'round here;Movin' slow like we sippin' on the Ac' 'round here, 'round here;We ain't gon' play 'round here, yeah, yeah;You can get caught in the wave 'round here, yeah;Fuck around and switch states 'round here, yeah;Rockin' that Bape like we apes 'round here, 'round here, yeah;We don't breaks 'round here;Won't fuck with no niggas that's fake 'round here, 'round here;Ain't nobody fake 'round here;Young nigga gotta do what it takes 'round here, 'round here;Niggas gettin' paid 'round here;I'll pull up in Lamb 'round here, 'round here, 'round here;Niggas hittin' licks 'round here;If she think that she gon' get hit 'round here, 'round here, 'round here;Ain't no games 'round here;Young nigga won't play 'round here, 'round here, 'round here;We was tryna stay low-key;Somehow e'rybody know me 'round here, 'round here;Y'all niggas talkin' them G's;My niggas been gettin' to the mills 'round here, 'round here;Y'all niggas ain't out here;Y'all niggas ain't out here"
"67","4ATl9ijSiEgNs9XCpdPL2t","Hunnid racks just like that (Yeah, slatt, slatt);Thirty bands slip through my hands (I said slatt)10k.Caash but I don't do no dance (It my slatt, 10k);Blueface, yeah, I can get these bands (Get these racks);It's like tie-dye in my chain (Tie-dye);My guy, please refrain (Oh);I am not your man, not your bro (Oh);She gon' bust it for your mans on the low (On the low);(Oh);Keed, talk to 'em;She know I got racks so she gon' put her head on repeat (Come here);I can drip in LV (LV), I can drip in CC (Chaneyney);Ridin' with the sticks, yeah, we shootin' like Call Of Duty (Frrt);Bentley truck got Forgis on it, we not ridin' no hoopty;VVS diamonds on me (Ice), got your ho like ""Oowee"" (Ooh);VVS diamonds on me, wet just like a coochie (Coochie);Jacuzzi, but we carry F&Ns, we not stain your uzi (Brrt, Keed, talk to 'em);Girl, stay on your shit, you better not lose it (Better not lose);Better not make me mad, I'll lose it (They know I'll lose);You say you a hitter, you ain't proved it (Nah, you ain't proved);Car foreign, stick foreign (Skrrt);Put a hitter on a Perc', it was early morning;Pull up, get a backend, ain't doing no tourin' (Backend, backend);23 on my coupe, I ain't talkin' no Jordan (23);You don't see no gun on me, somebody else totin' it (Yes, sir);Rubber band blue hundreds, I cannot fold it (Yes, sir);Cartier frames on me, just know I'm focused (Cartier frames);Drippin', no, I can't explain, diamond water like rain;Hunnid racks just like that (Yeah, slatt, slatt);Thirty bands slip through my hands (I said slatt);10k.Caash but I don't do no dance (It my slatt);Blueface, yeah, I can get these bands (Get these racks);It's like tie-dye in my chain (Tie-dye);My guy, please refrain (Oh);I am not your man, not your bro (Oh);She gon' bust it for your mans on the low (On the low);10k.Caash, just like that (Slatt, slatt);10k.Caash, but I don't do no dance (That's my slatt);Hunnid racks, just like that (Gettin' bands);Hunnid racks, yeah, it's gon' to make her dance (That's my slatt);10k.Caash, just like that (Yeah, ooh);Took my time and made this way, now I'm sittin' on bankroll (Yeah);Yeah, my diamonds factory, I never pay to make it glow;Addin' up zeros to these O's, and all my friends, they turn to foes;And now I'm pourin' up that four, that shit addictin', yeah, I know;Sittin' in PJ's with these PJ's, all my life this was a goal, yeah;Shoe size twelve and a half, but triple S is forty-four, yeah;Just came back from the Saks, I can't go back to lookin' broke, yeah (No);Bitches every weekend, boy, I drop 'em like some soap, yeah;Glamboy run for mayor 'cause he got so many poles, yeah;Fallin' asleep while my shit deep in, thought this Perc' would pick me up;Boy, I'm drownin' in the deep end, my whole body Saint Laurent (Deep);Avoidin' these charges, I'm a target, can't let 12 come get me stuck;Gettin' these backend, that's attractive, touchin' hunnids get me up;I got bad hoes, cuff 'em like my sleeves;Twenty bands on her, I just blacked out at Celine;Ran up on the plug, said I nee-nee-nee-nee-need;I'm a shootin' star, get to blowin' off some steam (Ooh);Hunnid racks just like that (Yeah, slatt, slatt);Thirty bands slip through my hands (I said slatt);10k.Caash but I don't do no dance (It my slatt);Blueface, yeah, I can get these bands (Get these racks);It's like tie-dye in my chain (Tie-dye);My guy, please refrain (Oh);I am not your man, not your bro (Oh);She gon' bust it for your mans on the low (On the low);10k.Caash, just like that (Slatt, slatt);10k.Caash, but I don't do no dance (That's my slatt);Hunnid racks, just like that (Gettin' bands);Hunnid racks, yeah, it's gon' to make her dance (That's my slatt);10k.Caash, just like that (Yeah, ooh)"
"68","1GGxh8QYLRZaQ07d6AHA8E","Empty bottles 'round us;Pills on the sink, yeah;Two blondes in my bed (My bed);No, I can't remember;If I hit last night, I'ma guess I did;I'ma live my life like my last, oh yeah;We gon' put it all in the past for real;Hey, that's for real, hey, that's the deal;Say you wanna get loose;Actin' like a fool, lovin' that shit;Tom Cruisen, it's a movie;I'ma move in and take this;Say, hop outta bed, rock out again;Hop outta bed, rock out again;Hop outta bed, rock out again;Hop outta bed, rock out again, yeah;I see dead people, niggas passed out;And bottle so lethal, we took 'em all down;Lock all the window, hot box the house;We do it all again 'cause you know how we about;If I hit last night, I'ma guess I did;I'ma live my life like my last, oh yeah;We gon' put it all in the past for real;Hey, that's for real, hey, that's the deal;Say you wanna get loose;Actin' like a fool, lovin' that shit;Tom Cruise, it's a movie;I'ma move in and take this;Say, hop outta bed, rock out again;Hop outta bed, rock out again;Hop outta bed, rock out again;Hop outta bed, rock out again, yeah;Hop out, rock out, yeah;Hop out, rock out (Yeah, yeah, yeah);Rock out, yeah, hop out (Rock all agin);Say you wanna get loose;Actin' like a fool, lovin' that shit;Tom Cruise, it's a movie;I'ma move in and take this;Say, hop outta bed, rock out again;Hop outta bed, rock out again;Hop outta bed, rock out again;Hop outta bed, rock out again, yeah"
"69","13f84H8l1ZhiAmTQKqiJDP","Ayy, ayy, ayy, ayy, ayy, that's probably Tago;Pipe that shit up, TnT;Tre made this beat;Let's talk 'bout hard times, real bottom boy survivor;Way before the jewelry, the groupie hoes, and designer;Back when I was tryna find a way for all my partners;Rema hit the window, popped the door for me and Lijah;'Member wakin' up with no destination;But I had some dedication, couldn't use my education;'Cause no nine dollars could help me face what I was facing;My light bill due, envelope blue, that mean you behind on payments;Rap slowed down and I was low on cash;Fresh out of high school, kicked out the house for living fast;Went and got a spot, then got a job, 'cause pops was on my ass;Then that's when pops had went to jail so it didn't last;Hit the block with Brock 'cause I was tryna pay my bills;Like fuck a rap career, let's touch these streets and make a mil';Fast forward, like Rod Wave, tell me how you feel;When I think about my past, that shit give me chills, uh;Wake up in the morning, hit my knees, and I pray;Because He finally made a way;I been runnin' up that paper, mama;And before I let 'em come and take it, mama;I'ma die in these Cuban links;I'm gon' die in these Cuban links (Bangers again);Die in these Cuban links (Right now today, let's go);Die in these Cuban links (Yes, Lord);All my life it been a struggle;You on and fall off, you find out who really love you;Playin' in the storm drain, came out the gutter;Good relationships, I admit I had a couple;Making love to the money, me and bae lil' couple;Yola cooked down to the oil in it, don't switch around;I need everything when it lock in the pot, yeah;Grab it off the top, let it dry, work the clock, yeah;Finally up in rank, movin' blocks, holdin' sham, yeah;Havin' my lil' way, ghetto pussy used to act funny;Now I'm hittin' her hard from the back, she throw it back for me;And when I went to jail, shawty left, turned her back on me;Flexin' on they ass, pants sag with them racks on 'em;Wake up in the morning, hit my knees, and I pray;Because He finally made a way;I been runnin' up that paper, mama;And before I let 'em come and take it, mama;I'ma die in these Cuban links;I'm gon' die in these Cuban links;Die in these Cuban links;Die in these Cuban links"
"70","4UJdEn1sYTNyerQei1fBSA","Almost broke my wrist but I still keep spendin' (Spendin'!);Almost broke my wrist, diamond still keep spinnin' (Spinnin'!);Hol' up;Walk in the dealer, blew like 150 (50!);Stunt so hard niggas might try and get me;Almost broke my wrist but I still keep spendin' (Spendin'!);Almost broke my wrist, diamond still keep spinnin' (Spinnin'!);I came from nothing, got no choose but to ball;Rolling on a sucker, watch me fall;Almost broke my wrist but I still keep spendin' (Spendin'!);Almost broke my wrist, diamond still keep spinnin' (Spinnin'!);Said you got some racks but it's really all cap (Cappin');Niggas sleeping on me need to wake up from they nap (Nappin');Getting foriegn bags from ever city on the map (Chyeah);I do it on the low I do not do it for the snap (No);I was making millions before I started wit the rap (rappin');When I go on stage everybody start to clap (clappin');I got it with the camera, I ain't get it with the trap (Trapping');I do not know you niggas do not reach out for no dap, no;Walk in the dealer paid like 150 (50!);Stunt so hard niggas might try and get me (Get me);Almost broke my wrist but I still keep spendin' (Spendin'!);Almost broke my wrist, diamond still keep spinnin' (Spinnin'!);I came from nothing, got no choose but to ball;Rolling on a sucker, watch me fall;Almost broke my wrist but I still keep spendin' (Spendin'!);Almost broke my wrist, diamond still keep spinnin' (Spinnin'!);Whole lots hoes backstage and they waitin';I don't show attention, but they like me, so they patient;But do she really like me, or the clout is what she chasing;Cause if that is the case, the she won't get a conversation;These goes be using me and this shit really my frustration;I cancel out my ex, like I am solving an equation;I got a different bitch in every city and location;It's 50 different bitches if count my calculations;Walk in the dealer, blew like 150 (50!);Stunt so hard niggas might try and get me (Get me);Almost broke my wrist but I still keep spendin' (Spendin'!);Almost broke my wrist, diamond still keep spinnin' (Spinnin'!);I came from nothing, got no choose but to ball;Rolling on a sucker, watch me fall;Almost broke my wrist but I still keep spendin' (Spendin'!);Almost broke my wrist, diamond still keep spinnin' (Spinnin'!)"
"71","3Z9vR8JrHFyyjB0JoHzx6p","Yeah, my bitch like girls;Think I might die young;Yeah, my bitch like girls;Think I might die young;UhYeah, my bitch like girls, but she like me 'cause I'm pretty;Think I might die young, but I don't wanna, it's a pity;Been a long damn night in a city that ain't with me;With a bad lil bitch, she like Britney, sniffin' whitney;Yeah, my bitch like girls, but she like me 'cause I'm pretty;Think I might die young, but I don't wanna, it's a pity;Been a long damn night in a city that ain't with me;With a bad lil bitch, she like Britney, sniffin' whitney;Well, my bitch like girls and that's a blessing;Can you rock my world, I gotta test it;Need it all right now, but I ain't stressing, no;I leave em guessing, lethal weapon, Smith and Wesson, woah;Let's get drunk, have some fun;Tell your friends to come, get it on;I think I might die young;And I don't want to, baby;But I been wilding lately;I know it drive you crazy;Yeah, I got something to prove;I said I'm good on my own;I don't need nothing from you;But we could still get it on;If you bring a friend or two;Know I ain't known you for long;But I know;Yeah, my bitch like girls, but she like me 'cause I'm pretty;Think I might die young, but I don't wanna, it's a pity;Been a long damn night in a city that ain't with me;With a bad lil bitch, she like Britney, sniffin' whitney;Yeah, my bitch like girls, but she like me 'cause I'm pretty;Think I might die young, but I don't wanna, it's a pity;Been a long damn night in a city that ain't with me;With a bad lil bitch, she like Britney, sniffin' whitney;How I'm living, no religion;No forgiveness, Lord forgive me;I've been sinnin' all damn weekend;I've been sippin' through the evening;No forgiveness, they don't feel me;Say they miss the fucking real me;Shaking hands with all my demons;Did some shit, you wouldn't believe it;Me and shawty off them drugs, we can't see shit;We been acting wild as fuck for no reason;Shawty roll the blunts and call some friends;She don't front, she confident;I'm destructive with no shame;I might go and tat her name;Know I love them crazy bitches;Oh, I love the way she lick it;She been drippin' all damn evening;We been winning all damn season, like it'sLike it's all star weekend;Yeah, my bitch like girls, but she like me 'cause I'm pretty;Think I might die young, but I don't wanna, it's a pity;Been a long damn night in a city that ain't with me;With a bad lil bitch, she like Britney, sniffin' whitney;Yeah, my bitch like girls, but she like me 'cause I'm pretty;Think I might die young, but I don't wanna, it's a pity;Been a long damn night in a city that ain't with me;With a bad lil bitch, she like Britney, sniffin' whitney;Yeah, my bitch like girls;Think I might die young;Yeah, my bitch like girls;Think I might die young"
"72","79s5XnCN4TJKTVMSmOx8Ep","Traphouse Mob;Huh,  roll another one;Said  I'm never lackin', always pistol packing;With them automatics, we gon' send him to heaven;Wait, wait, wait, wait, ayy, ayy, woo (Aw, shit), huh;Oh  you feelin' sturdy, huh? (You feelin' sturdy, man);Let  me see somethin';Shake it, shake it, shake it;She  like the way that I dance;She like the way that I move;She like the way that I rock;She like the way that I woo;And  she let it clap for a nigga;(She let it clap for a nigga);And she throw it back for a nigga;(Yeah, she throw it back for a nigga);Mike Amiri, Mike Amiri;Billie Jean, Billie Jean (Uh);Christian Dior, Dior;I'm up in all the stores;When it rains, it pours;She like the way I rrr;Mike Amiri, Mike Amiri;Billie Jean, Billie Jean (Uh);Christian Dior, Dior;I'm up in all the stores;When it rains, it pours;She like the way I rrr;When I walk in the spot, thirty on me;Buy out the club, niggas know that I'm paid;Bitch, I'm a thot, get me lit;I can't fuck with these niggas 'cause niggas is gay;All on my page suckin' dick;All in my comments and screamin' my name;While I'm in the club, throwin' them hundreds and fifties and ones and ones;Pop Smoke, they know I'm wildin';If I'm on the island, I'm snatchin' the cell;Brody got locked, denied his bail;Until he free, I'm raisin' hell;Tell my shooters call me Face;Time;For all the times we had to face time;Free D-Nice, he doin' state time;If you need the glizzy, you could take mine;Please don't come out your mouth, you know I'm like that;I'll make a movie like TNT;Glock-30 on me, ask who really want it;I bet I air it like BNB;Nappy Blue wildin' in my section;And I keep that .38 for the weapon;Remember when I came home from corrections;All the bad bitches in my direction;She like the way that I dance;She like the way that I move;She like the way that I rock;She like the way that I woo;And she let it clap for a nigga;(She let it clap for a nigga);And she throw it back for a nigga;(Yeah, she throw it back for a nigga);Mike Amiri, Mike Amiri;Billie Jean, Billie Jean (Uh);Christian Dior, Dior;I'm up in all the stores;When it rains, it pours;She like the way I rrr;Mike Amiri, Mike Amiri;Billie Jean, Billie Jean (Uh);Christian Dior, Dior;I'm up in all the stores;When it rains, it pours;She like the way I rrr"
