"","id","lyric"
"38","2zlNCIul7xAVlyISv4MhBO","Where it go?;Yeah, uh;Uh, hold on, hand me the light folk;Uh, I just came in the bitch after midnight and did two songs, it's 3 o'clock;Hunnid Bans, that's light work;Hunnit bands, whip (Whip);Hunnit bands, drip (Ayy);Understand, chain real, hunnid grams and it's dipped;Hunnit bands, when I dip;Hunnit bands, in my clip;Hunted man (Raa), runnin' man (Runnin' man);(Uh) Bitches eyein' me in front they man (Ayy);I'm just throwing this shit, I don't want a dance;You worth a 100;K that ain't no money then (Stupid ass);Come through if I want to, I'll blow a hunnid bands (Ayy);G Herbo I'm still independent, wassup?;200;K on a pendant, that's none;30 point stars and two pendants, not one;You niggas diamonds and pieces be crushed;I dropped a three in that peach on that Crush (Peach);Vic off a Perc, when he speak and he slur (Ayy);I don't do clutchin', I reach in and dump;Don't lose your life tryna tweak and be dumb (Dummy);End up a tragedy thinkin' he tough;Swerve got a ratchet, he thinkin' he buff;Man he gon' clap it, he thinkin' he bluff;Slide and they die 'til they think it's enough;Summer first heard of seventeen, I ain't never hear of nun countin' up like, ""Fuck!"" (Whoo);23 and a nigga still grind like I ain't got none countin' up like, ""Fuck!"" (Nigga);You think your bitch wanna fuck, but news flash I already plucked her (Boy);Been hittin' niggas baby mothers and others;I don't pillow talk, that's for suckers (Suckers, pussy);Yo soul gon' be a lil cold motherfucker, he don't even sleep under covers (For real, no bap);Rich as fuck, I'm behavin' like I want another one, still don't be fuckin' with rubbers (Shit);Even though the whole world full of lollipops, still don't be fuckin' with suckers (Hell nah);I don't let niggas hop in my car a lot, like I be fuckin' with ruckus (Fuck niggas);Niggas sneak diss a lot then get zip lipped out in public, where was all that ruckus? (Pussy boy);Niggas flex on the Gram then they can't get out of jail, where were all them ducketts?;Run through it all like fuck it (Fuck it);Every bitch I call they fuckin' (I'm fuckin' 'em);Never brought flame ain't dumped it (Huh?);Never bought chains and tucked it (Huh?);Name a lame you saw me come with (Name 'em);Name a time we ain't on that fuck shit (Name it);Name a time you heard me ask for shit (Name it);Name a time when we a front shit (Pussy);Hunnit bands, whip (Whip);Hunnit bands, drip (Drip);Understand, chain real, hunnid grams and it's dipped;Hunnit bands, when I dip;Hunnit bands, in my clip;Hunted man (Raa), runnin' man (They runnin');Rich as a bitch, need you for shit;Whip on my wrist, whip for my bitch;Patek the wrist, static, it's lit;Hand me the glick (Grr);Pass me the glick, that's a assist;Poppin' the Belaire, pass me a sip;Pass me the zip, cash me a zip;You know I get cash for that shit (Nigga);You know any nigga blow a hunnid bands smashin' that bitch (You already know that);You know I bend brand new Hellcat, straight eight, just ride pass in that bitch (Come on, now, you know that);You know we was first young niggas pull up foreign whips dumpin' our ash in that bitch (Huh?);And you know I'm the youngest rich nigga in my hood already, don't ask me that, bitch;Bitch;Hunnit bands, whip (Whip);Hunnit bands, drip (Drip);Understand, chain real, hunnid grams and it's dipped;Hunnit bands, when I dip;Hunnit bands, in my clip;Hunted man (Graa), runnin' man (Ayy)"
"39","7tvb6TUeR2wAcBLuZVTkgw","Yeah, yeah;I can show you what it is;I been on the— that's the only way to live;Yeah, I can show you what it is;Yeah, I can show you what it is (Ayy);I can show you what it is;I been on the guala, that's the only way to live (Ayy, ayy);I been on the come up from the bottom, where I live (Ayy, ayy);I been on the guala, that's the only thing I get (Ayy, ayy);Call you from the west side, I let you know (Yeah);I ain't tryna fuck with you, I show you what I know (Yeah);Problems always watchin' and that's everywhere I go (Yeah);Problems, gotta solve 'em unless I just let it go (Yeah);Call you from the west side, I let you know (Yeah);I ain't tryna fuck with you, I show you what I know (Yeah);Money like a vibe and that's the only way to go (Yeah);Money like a vibe and that's the only thing I know (Yeah);Call you from the west side, I let you know (Yeah);I ain't tryna fuck with you I show you what I know (Yeah);Money like a vibe and that's the only way to go (Yeah);Money like a vibe and that's the only thing I know (Yeah, ayy);Take a chance, slow it down, tell me what you know now;Tell you how it's goin' down, I just can't move slow now;Certain things I'm meant to do, visions in my dust now;I'm just tryna get next to you, wanna put my blunt down;Up on our residuals, concepts flood my thoughts now;Different individual, tell you how it's goin' down;Place the shit ahead of you, tell you how it's goin' down;That's the shit, I'm here for you and that shit is going down;Coastal, lemme take you coastal;Treat you like you supposed to;Over, what you gon' do?;Lemme bring you closer, pass that shit, you over;Hate it when we sober, I'ma need you over, hate it when you—;Coastal, lemme take you coastal;Treat you like you supposed to;Over, what you gon' do?;Hate it when you gone but I want you close now;Money talk, I go now;Live this life, it's goin' down (Ayy);Call you from the west side, I let you know (Yeah);I ain't tryna fuck with you, I show you what I know (Yeah);Money like a vibe and that's the only way to go (Yeah);Money like a vibe and that's the only thing I know (Yeah);Call you from the west side, I let you know (Yeah);I ain't tryna fuck with you, I show you what I know (Yeah);Money like a vibe and that's the only way to go (Yeah);Money like a vibe and that's the only thing I know (Yeah);I just want it easy, call me when you need me;Girl I do a lot for you, that's any time you need me;Shawty what I needed, like money she a fact;Sleepin' on me, what's the reason?;I hit 'em with that check;All I left she said, ""Deceiving"", and all I did was flex;Now she watchin' for a reason, she see I'm really next;Count this shit up like it's treason and all I did was flex;Fully equipped so what's the reason?;She see I'm with the check;Coastal, lemme take you coastal;Treat you like you supposed to;Over, what you gon' do?;Lemme bring you closer, pass that shit, you over;Hate it when we sober, I'ma need you over, hate it when you—;Coastal, lemme take you coastal;Treat you like you supposed to;Over, what you gon' do?;Hate it when you gone but I want you close now;Money talk, I go now;Live this life, it's goin' down (Ayy);Call you from the west side, I let you know (Yeah);I ain't tryna fuck with you, I show you what I know (Yeah);Money like a vibe and that's the only way to go (Yeah);Money like a vibe and that's the only thing I know (Yeah);Call you from the west side, I let you know (Yeah);I ain't tryna fuck with you, I show you what I know (Yeah);Money like a vibe and that's the only way to go (Yeah);Money like a vibe and that's the only thing I know (Yeah, ayy);Yeah, yeah (Yeah, yeah), ayy, ayy;Yeah, yeah (Oh-oh, oh-oh-oh);Yeah-yeah-yeah, yeah-yeah-yeah;Oh-oh, oh-oh-oh, ayy"
"40","2psYPA9F1ncGmIBk4fQgKO","Bitch I'm Lil Rarri but you know I'm calling all the shots;Young nigga hop out with a new Jag;Put 40 bands in the book bag;I'ma fuck that lil' bitch and finesse her;I took 30 right off of the dresser;20 bands on my neck i ain't lose that;We don't fuck with you nigga then move back;Pocket rocket young nigga gone shoot that;Full loaded clip in the book bag;I'm the wave ain't no motherfuckin' durag;30 will push your whole dude back;Who the fuck in the place nigga who that;I just beat that lil pussy that loose cat;He a blood that nigga a bool bat;Motherfucker you pussy like who cap;Im bonceited these niggas they knew that;I don't fuck with nobody so move back;I just fucked a lil' bitch in the A;Went to the plug stole a draco;Drilling up in your place if I say so;I don't play with my money no play dough;Peep the ice on my neck I'm Anemic;Nigga hop out the 40 I'm beaming;See the blood in his face and he leaking;Just like Kodak i be the lil' demon;8lbs bitch i made off a lick;Need to chill cause I'm boutta get rich;Big sound they like how you did this;Niggas trippin' they fold like a bitch;Piss down nigga all on my wrist;I just fuck her I don't got to kiss;Bling blow nigga you see the rainbow;Punch a nigga with all diamond fists;All the diamonds vvs;I just fuck with new hoes not my exes yeah;20 bands I might go buy her a new necklace;Bitch don't call my brodie wildin' yea he reckless;All my diamonds Cuban linked up;I got bitches trying to link up;Now lil' shorty trying to call up;Think a nigga stupid aww look;I'm just finna thrasher i be killing it;Nigga I'm the don Don diddley;Niggas talking they ain't killing me;Had to drop the shorty I ain't feeling it;Imma whip up the foreign a new bag;Nigga cooking i call it the stu crack;I just fucked your lil bitch you ain't knew that;If I'm doley i might bring the 2 back;I do not know where your boo at;She was topping my bro i ain't notice;Bitch i come off the dome i ain't wrote this;Bitch I'm shining i don't need no Rolex;Just fucked a lil bitch in the A;Went to the plug stole a draco;Drilling up in your place if I say so;I don't play with my money no play dough;Peep the ice on my neck I'm Anemic;Nigga hop out the 40 I'm beaming;See the blood in his face and he leaking;Just like Kodak i be the lil demon;8lbs bitch I made off a lick;Need to chill cause I'm boutta get rich;Big sound they like how you did this;Niggas trippin they fold like a bitch;Piss down nigga all on my wrist;I just fuck her I dont got to kiss;Bling blow nigga you see the rainbow;Punch a nigga with all diamond fists;Bitch I remember;For them nights we done hit up a cold lick made a crazy December;Daddy really never gave me no nun so when i make it it'll be all for my momma;Nigga thought that we was best friends but i peep that you changing it was for the better;Dont compare me to a motherfucking pee;Blow the choppa blow it right on his feet;I done like 50 bands in a week;Plug callin nigga took all the Ps;Opps callin trying find where I sleep;On the block wildn nigga fuck with a G;Bitch I promise i done shed many tears;Fuck they talking trying to end my career;Mouth shining call it new chandelier;Big rarri i done signed up a deal;All the diamonds vvs;I just fuck with new hoes not my exes yeah;20 bands i might go buy her a new necklace;Bitch don't call my brodie wildin yea he reckless"
"41","2DnyKpPcFpC460wLJeGzOs","Damn, BT;New money, old money keep piling;New bag, brand new deposit;New bag, brand new deposit;New money, old money keep piling;This shit keep piling;New bag, brand new deposit;Brand new deposit;Fuck drip, I don't need no stylist;I don't need no stylist;Know the plug, I ain't talkin' 'bout socket, no;I ain't talkin' 'bout socket;I ain't on no molly;Percocets all inside of my body;I thought 'bout takin' them Roxys;But I told myself I need to stop it;Wanna take my bitch on an island;Do whatever to see you smiling;When I give her wood, she holler;But I never thought about going Holly', no;My baby, my baby, my baby;Might cop you a new Mercedes;You be driving these lil' bitches crazy;You be driving these lil' bitches crazy;We even had thoughts on a baby;We even had thoughts on a baby;But fuck what they sayin', we too damn old to be playing;Why tell me some shit if you know it's a lie?;Why say you fuck with me but then leave my side?;It was so many times when I needed you by;I was left all alone, all I could do was cry;Your love like a drug, this shit got me so high;My feelings too strong, put my pride to the side;I be thinking 'bout too much, I hope I don't die;Got family who need me, we gotta survive;New bag on bag, I got it;Want me in your city, send me your deposit;They talkin', all they do is gossip;But that's the main reason I don't fuck with nobody;Them niggas I run with, they wildin';I pray to God I don't have to step on nobody;I know that they watchin', to the streets, forever I'm locked in;New money, old money keep piling;This shit keep piling;New bag, brand new deposit;Brand new deposit;Fuck drip, I don't need no stylist;I don't need no stylist;Know the plug, I ain't talkin' 'bout socket, no;I ain't talkin' 'bout socket;I ain't on no molly;Percocets all inside of my body;I thought 'bout takin' them Roxys;But I told myself I need to stop it;Wanna take my bitch on an island;Do whatever to see you smiling;When I give her wood, she hollerin';But I never thought about going Holly', no;Just want you smiling;Forever I'm with you, in love with this feeling, if you rollin', I'm rockin';Let's run up some money together and leave all them broke bitches watching;Like what the fuck is we gon' do with a wallet?;It's crazy how I seen a million dollars;I dropped out of school and I ain't go to college;Bitch give me more neck than a collar;She fuck the whole team, we put her on the roster;Can't fuck with that ho, she got bodies;She ride too much dick, that girl got too much mileage;We be thuggin' and clutchin', we up and bust it, I swear I'm surrounded by shottas;I really got too many problems;I go through a lot and that's why I just need me a rider;Tell the truth, do you really love me? Do you really fuck with me?;Tell the truth, do you really love me? Do you really fuck with me?;Tell the truth, do you really love me? Do you really fuck with me?;Wanna show you what you never seen, this island called 23;New money, old money keep piling;This shit keep piling;New bag, brand new deposit;Brand new deposit;Fuck drip, I don't need no stylist;I don't need no stylist;Know the plug, I ain't talkin' 'bout socket, no;I ain't talkin' 'bout socket;I ain't on no molly;Percocets all inside of my body;I thought 'bout takin' them Roxys;But I told myself I need to stop it;Wanna take my bitch on an island;Do whatever to see you smiling;When I give her wood, she hollerin';But I never thought about going Holly', no;Thought about going Holly', no;Island, take my bitch on a island, oh"
"42","3VyjsVV24RmBIbWJAeUJNu","I know, I know, I know that you're drunk (Yeah);Tell me what you want after this club (Oh-oh);You know I get nasty (Know I get nasty);Uber ride to my house, called a taxi (Uber ride to my house, yeah);I'm picky with my women, I'm decidin' (Oh);Call me to your crib and I'ma slide in (Yeah);I'm picky with my women, I'm decidin' (Oh);Call me to your crib and I'ma slide in (Call me to your crib and I'ma);First things first let me get that introduction (Let me get that introdu—);We on a long road to self-destruction (Self-destruction);You were so in love, you weren't gon' tell me nothin' (You were so in love);Let me get this clear (Uh-huh), 'cause I had no idea (Yeah, yeah, yeah);Feelin' like I did too much (Much);I'm feelin' like I did too much (Much);Well, let's get naughtier (Naughtier);Yeah, I need all of ya (All of ya);I'm feelin' like I did too much (Much);I'm feeling like I did too much (Much);Yeah, let's party, ya (Party, ya);Yeah, I need all of ya (All of ya);Uh, uh, uh, uh, yeah;Uh, uh, uh, uh, yeah;Uh, uh, uh, uh, yeah;Uh, uh, uh, uh, yeah;Uh, uh, uh, uh, yeah;Uh, uh, uh, uh, yeah;Uh, uh, uh, uh, yeah;Uh, uh, uh, uh;First things first let me get that introduction;We on a long road to self-destruction;You were so in love, you weren't gon' tell me nothin';Let me get this clear, 'cause I had no idea;Feelin' like I did too much (Much);I'm feelin' like I did too much (Much);Well, let's get naughtier (Naughtier);Yeah, I need all of ya (All of ya);I'm feelin' like I did too much (Much);I'm feeling like I did too much (Much);Yeah, let's party, ya (Party, ya);Yeah, I need all of ya (All of ya);Since you've been gone, I've been just okay;I know you mad, you didn't see it my way;Since I've been gone, I've been out of space;I let lil' shawty, come here, take your place;Ooh, you got it (Got it);You couldn't keep my love, you too exotic (Couldn't keep my love, yeah);You want a paper plane, I don't mind it (You want a paper plane, yeah);You wonder why your girl always whining (Wonder why your girl, yeah)"
"43","0gUBjAB8Hf9X8G1vOtlf61","Pipe that shit up, TNT;No, no, no, no (NLE the top shotta);Ayy, ayy (Trap jumpin' like two-three);Feel the pain and it's floating, something fun;I ain't even go to college, got me runnin';I ain't even go to college, got me runnin';I'm off the Percocets, bitch, I'm off the molly;So much shit been on my mind that I don't know where to start;My chest, it hurts from this pain, I think I need a new heart;Can't forget you for what you did, 'cause you took it too far;I had to cut this lil' bitch off, 'cause she wasn't playin' her part;I'm doin' right about you, but you still neglect me;If I didn't had the money or the fame, would you still text me?;I don't wanna tote no gun, I know the crackers gon' arrest me;But if they opposite me out in person;You know they gon' bless me;They say I'm overrated, because I'm most hated;They throwin' dirt up on my name, but I'm dedicated;Got suicidal thoughts goin' through my brain daily;And don't nobody understand the problems that I have;Gino died November 10th, just a month before Christmas;My birthday on November 1st, so you know that shit hit me;My brother came into the room and he said ""Gino dead"";Slim chance he gon' make it, he got shot in the head;On Instagram, everybody sayin' ""Pull it through"";I said I prayed that you make it but it didn't save you;And I don't wanna see you land in the ICU;And I didn't go to the funeral, I can't see you in the tomb, no;Pain, pain;What did I do, ooh, to lose you;Pain, pain;What did I do, ooh, to lose you;You did some shit I can't let go, I forever got my grudge;You can't fault me for actin' different, you know that you was there;My heart get weaker and weaker, I'm tryna keep my fuckin' head up;Rock, you either land on a bunk or a headstone;They say that I'm a bitch, and I ain't been through shit;Well, have you been in a shootout and seen your homie get hit?;Or have you ever been in love and distressed by a bitch?;And then she fuck another nigga, I'm killin' both of them bitches;So many shit is blindin' me, I think I need me some seafood;I mind my own business, I don't give a fuck what he do;My own nigga stole from me, you got to watch your people;He sayin' that he real, but I know that shit is see-through;And I can't lie, I'm dead inside;Bullets flyin', homicide;Traumatized, my dogs keep dyin';Free my dog, he facin' time;I'm hurt, I have to put it on my sleeve;Prayin' to the Lord, only time I'm on my knees;I'm like, ""Please"";I'm like, ""Jesus, please, keep me on the right road, the devil out of me"";Pain, pain;What did I do, ooh, to lose you;Pain, pain;What did I do, ooh, to lose you"
"44","2le1DeNWE6DXc81sH5uI4i","(Yeah);I had to show niggas I'm really back (Yeah);They thought I fell off, now they takin' it back (Huh?);Phantom got curtains, I sit in the back (Sit in the);Amiris too tight, I still stuff 'em with racks;Tell 'em, ""Fuck the tint,"" I want everybody see me;Brand new truck came with six TV'sVVS diamonds, they the ones that blinded Stevie (Wonder);Huh? Yeah;Huh? Yeah;Huh?;Yeah;I had to show niggas I'm really back (Yeah);They thought I fell off, now they takin' it back (Huh?);Phantom got curtains, I sit in the back (Sit in the);Amiris too tight, I still stuff 'em with racks;Tell 'em, ""Fuck the tint,"" I want everybody see me;Brand new truck came with six TV'sVVS diamonds, they the ones that blinded Stevie (Wonder);(Huh?) I check my bank and I smile (Yeah);How the fuck I got lost in my house (Huh?);Let him test and he tried to run off;So I left the lil' nigga deceased on the ground (Doo-doo);He get smoked like a new Black & Mild;Dig his grave up right under a towel (Huh?);Then walk away with a smile (Hah);I ain't takin' no planes, yeah, I'm flyin' private;Brand new G5 came with a new pilot (G5);Nigga can't see us 'cause we chillin' on reserved islands (Yeah);Still poppin' shit when there's no cameras (Hey);Cartier my glasses, Cartier my watch (Cartier);Told them bitches fuck and let all my niggas watch;Water on my body like I fell off a dock;Real dope boy, got dope in my sock (Huh?);Fucked one time, then I left the ho clueless;Let the bitch choose 'cause these hoes be choosin' (Yeah);I'm goin' dumb for the racks, goin' stupid;And I don't gotta say I'm rich, nigga, it's proven;And I don't ever hesitate, nigga, I'm shootin' (Doo-doo);Ten M's up, how the fuck am I losin'?;Hop in the Lam', no reason, I'm cruisin';I just made the bitch suck my dick 'til she toothless (Hah);(Yeah);I had to show niggas I'm really back (Yeah);They thought I fell off, now they takin' it back (Huh?);Phantom got curtains, I sit in the back (Sit in the);Amiris too tight, I still stuff 'em with racks;Tell 'em, ""Fuck the tint,"" I want everybody see me;Brand new truck came with six TV'sVVS diamonds, they the ones that blinded Stevie (Wonder);D-Diego;Go Grizz;Sool, we got one, nigga"
"45","0XWfs97wqncRv28sfS0aUW","You the plug?;I, goddamn, make folks, goddamn, you feel me?;Sign up for that shit, you feel me?;So who the plug?;My partner, bruh;So what do you do? You the middleman, right?;Nah I like tell 'em to goddamn, make them folks;Are you the middleman?;Yuh;Okay;Hitting the West End;Quicker than Tekken;With an investment;I want that bag;Kinda like check-in;Finna keep texting the plug like, ""Check-in"";I want that cash;Hit him up desperately;I definitely had nothing to eat;My pride don't really mean nothing to me;Nigga fuck what you think;Imma jugg everything I can;And I might get a dog, no cap;And I might get my dawg a strap;And a Mike Vick pic autographed;And a mic to get off these raps;Think that money be changing my mood and shit;I be thinkin' 'bout what I'ma do with it;I be having them dreams about getting it;I be having nightmares about losing it;(Hold on, bruh, start over one more time);I be up in the air like I'm Superman;She the swoop, I'm not swooping in;No I'm not judging, you do what you do;And then do again what you was doing then;Hit me back up when you through with it;Fuck, man, this shit ain't go through again;This shit was 'posed to go through at ten;Bruh;Oh shit, bruh, we just hit!;Oh shit, bruh, we just hit!;Oh shit, bruh, we just hit!;Oh shit, bruh, we just hit!;Oh shit, bruh, we just hit!;Oh shit, bruh, we just hit!;Oh shit, bruh, we just hit!;Oh shit, bruh, we just hit!;And it look like a few bands;What the Fuck;I ain't never had cash;Now I'm up;Having this shit on smash;That's what's up;Having this shit on smash;That's what's up;(Free);You already got an account?;Yeah;Nah you gotta goddamn open that shit like;I already gotta account;Oh for real?;And I can't believe this shit really real;I was just fucked up off of Dill;Now I'm walking with the sack bruh for real;And I used to have to scrape for a meal;Anything a nigga ate, had to steal;Niggas goin' from an L to an M;(Tight);Running up a check;Running numbers up, a hundred;Coming in again really wanna get another hit;Doubling the licks;Double hits up and dub a nigga clique;Double dutch yeah we jump a nigga quit jumping in it;Jumbalaya with the kick, lions in the den;I got em buying into it, I know that it look like I just hit a lick;So how much you get paid?;I get, I get, goddamn, half of what he get, you feel me?;What he be getting?;Like six;600?;Yeah, nah, six bands;Six bands?;Yeah;How much, you made three bands before?;Yeah;Oh shit, bruh, we just hit!;Oh shit, bruh, we just hit!;Oh shit, bruh, we just hit!;Oh shit, bruh, we just hit!;Oh shit, bruh, we just hit!;Oh shit, bruh, we just hit!;Oh shit, bruh, we just hit!;Oh shit, bruh, we just hit!;And it look like a few bands;What the Fuck;I ain't never had cash;Now I'm up;Having this shit on smash;That's what's up;Having this shit on smash;That's what's up;(Free);What you buy?;Goddamn, I just be splurging on shit, bruh"
